{"attribution":"Trending and token identity data provided by CoinGecko.","captured_at_utc":"2026-10-13T08:45:52.148071Z","execution_allowed":false,"identity_cache":{"bitcoin":{},"bunker-mode":{"cached_at_utc":"2026-10-13T08:45:52.148071Z","platforms":{"ethereum":"0x41a4594575557efbf85cd950749bb0c1e99bcefd"}},"claudia-4":{"cached_at_utc":"2026-10-13T08:45:52.148071Z","platforms":{"robinhood":"0x43fc3c8440d85d7df99ecfbc6a267de8327f923b"}},"crawlerpad":{"cached_at_utc":"2026-10-13T08:45:52.148071Z","platforms":{"solana":"CQCDTp8rsFV3PhaPeYjcCW5LdGTxi6jFx7eC3UXnpump"}},"hyperliquid":{"cached_at_utc":"2026-10-13T08:45:52.148071Z","platforms":{"hyperliquid":"0x0d01dc56dcaaca66ad901c959b4011ec"}},"identity-md-6900":{"cached_at_utc":"2026-10-13T08:45:52.148071Z","platforms":{"robinhood":"0xe3e3df8bfb891d269a78ee33a456d36fb7344ec1"}},"near":{"cached_at_utc":"2026-10-13T08:45:52.148071Z","platforms":{"":""}},"pearl-2":{"cached_at_utc":"2026-10-13T08:45:52.148071Z","platforms":{"":""}},"pudgy-penguins":{"cached_at_utc":"2026-10-13T08:45:52.148071Z","platforms":{"abstract":"0x9ebe3a824ca958e4b3da772d2065518f009cba62","binance-smart-chain":"0x6418c0dd099a9fda397c766304cdd918233e8847","ethereum":"0x6418c0dd099a9fda397c766304cdd918233e8847","hyperevm":"0xfa44c2634ff17cbe26dc3007d36bd61c79068c14","hyperliquid":"0x1765b5a9ec8fc3cdbc209c63cac68e86","robinhood":"0x74be72affafbc8de30f0c11247814036314d625f","solana":"2zMMhcVQEXDtdE6vsFS7S7D5oUodfJHE8vd1gnBouauv"}},"pump-fun":{},"quantus":{"cached_at_utc":"2026-10-13T08:45:52.148071Z","platforms":{"":"","near-protocol":"qtc.omft.near"}},"sonic-3":{},"starknet":{},"sui":{},"wisp-2":{"cached_at_utc":"2026-10-13T08:45:52.148071Z","platforms":{"robinhood":"0x370dd1181288392843bf52d998eb85c735d91688"}}},"items":[{"coingecko_id":"wisp-2","dex_pairs":[{"age_seconds":78937,"buys_sells_by_period":{"h1":{"buys":866,"sells":619},"h24":{"buys":27857,"sells":15250},"h6":{"buys":5883,"sells":3906},"m5":{"buys":60,"sells":50}},"captured_at_utc":"2026-10-13T08:45:52.148071Z","chain":"robinhood","coingecko_platform":"robinhood","dex_id":"uniswap","fdv_usd":20444803,"is_primary":true,"liquidity_usd":452757.53,"market_cap_usd":20444803,"pair_address":"0xCAC1414EaC15AF7a6a5fcC8BD578CbEd0F9A4D15","pair_created_at_utc":"2026-10-12T10:50:15Z","pair_url":"https://dexscreener.com/robinhood/0xcac1414eac15af7a6a5fcc8bd578cbed0f9a4d15","price_change_by_period":{"h1":-5.78,"h24":276782,"h6":38.82,"m5":0.38},"token_address":"0x370dd1181288392843bf52d998eb85c735d91688","volume_by_period":{"h1":708614.08,"h24":20529273.5,"h6":4243884.28,"m5":43418.9}},{"age_seconds":77879,"buys_sells_by_period":{"h1":{"buys":1,"sells":0},"h24":{"buys":7,"sells":0},"h6":{"buys":2,"sells":0},"m5":{"buys":0,"sells":0}},"captured_at_utc":"2026-10-13T08:45:52.148071Z","chain":"robinhood","coingecko_platform":"robinhood","dex_id":"uniswap","fdv_usd":4768918,"is_primary":false,"liquidity_usd":1.29,"market_cap_usd":4768918,"pair_address":"0xf7ab404d0c9c4680abbccdd16b4f90dd137e050e601dc0822b4c5b6d891ea6aa","pair_created_at_utc":"2026-10-12T11:07:53Z","pair_url":"https://dexscreener.com/robinhood/0xf7ab404d0c9c4680abbccdd16b4f90dd137e050e601dc0822b4c5b6d891ea6aa","price_change_by_period":{"h1":12.96,"h24":237,"h6":28.95},"token_address":"0x370dd1181288392843bf52d998eb85c735d91688","volume_by_period":{"h1":0.19,"h24":0.84,"h6":0.38,"m5":0}},{"age_seconds":78600,"buys_sells_by_period":{"h1":{"buys":1,"sells":0},"h24":{"buys":7,"sells":0},"h6":{"buys":2,"sells":0},"m5":{"buys":0,"sells":0}},"captured_at_utc":"2026-10-13T08:45:52.148071Z","chain":"robinhood","coingecko_platform":"robinhood","dex_id":"uniswap","fdv_usd":2865491,"is_primary":false,"liquidity_usd":0.76,"market_cap_usd":2865491,"pair_address":"0xf10f4ea1a9c558bcef4f9f6d2d87606446d359dd22f701d9e9fe3ce3b0e3323e","pair_created_at_utc":"2026-10-12T10:55:52Z","pair_url":"https://dexscreener.com/robinhood/0xf10f4ea1a9c558bcef4f9f6d2d87606446d359dd22f701d9e9fe3ce3b0e3323e","price_change_by_period":{"h1":13.18,"h24":117,"h6":23.24},"token_address":"0x370dd1181288392843bf52d998eb85c735d91688","volume_by_period":{"h1":0.19,"h24":1.17,"h6":0.31,"m5":0}},{"age_seconds":25974,"buys_sells_by_period":{"h1":{"buys":1,"sells":0},"h24":{"buys":3,"sells":0},"h6":{"buys":3,"sells":0},"m5":{"buys":0,"sells":0}},"captured_at_utc":"2026-10-13T08:45:52.148071Z","chain":"robinhood","coingecko_platform":"robinhood","dex_id":"uniswap","fdv_usd":2424864,"is_primary":false,"liquidity_usd":0.38,"market_cap_usd":2424864,"pair_address":"0xe030f87780e54e991659190439b451c59cc78ee09bcd3fa3e5b564ce8e5f607f","pair_created_at_utc":"2026-10-13T01:32:58Z","pair_url":"https://dexscreener.com/robinhood/0xe030f87780e54e991659190439b451c59cc78ee09bcd3fa3e5b564ce8e5f607f","price_change_by_period":{"h1":16.45,"h24":37.65,"h6":37.65},"token_address":"0x370dd1181288392843bf52d998eb85c735d91688","volume_by_period":{"h1":0.14,"h24":0.4,"h6":0.4,"m5":0}}],"fomo_watch":{"disclaimer":"Descriptive observations only; no score, direction, or trade gate.","observations":[{"age_seconds":78937,"kind":"PAIR_UNDER_24H","pair_age_seconds":78937,"source":"DEX Screener"},{"age_seconds":78937,"fdv_or_market_cap_usd":20444803,"kind":"LIQUIDITY_UNDER_5_PERCENT","liquidity_usd":452757.53,"ratio_pct":2.2145360363707103,"source":"DEX Screener"},{"age_seconds":78937,"buys_24h":27857,"kind":"BUY_SELL_IMBALANCE","sells_24h":15250,"source":"DEX Screener 24h transactions"},{"age_seconds":77879,"kind":"PAIR_UNDER_24H","pair_age_seconds":77879,"source":"DEX Screener"},{"age_seconds":77879,"fdv_or_market_cap_usd":4768918,"kind":"LIQUIDITY_UNDER_5_PERCENT","liquidity_usd":1.29,"ratio_pct":2.7050161063788473e-05,"source":"DEX Screener"},{"age_seconds":78600,"kind":"PAIR_UNDER_24H","pair_age_seconds":78600,"source":"DEX Screener"},{"age_seconds":78600,"fdv_or_market_cap_usd":2865491,"kind":"LIQUIDITY_UNDER_5_PERCENT","liquidity_usd":0.76,"ratio_pct":2.6522505218128412e-05,"source":"DEX Screener"},{"age_seconds":25974,"kind":"PAIR_UNDER_24H","pair_age_seconds":25974,"source":"DEX Screener"},{"age_seconds":25974,"fdv_or_market_cap_usd":2424864,"kind":"LIQUIDITY_UNDER_5_PERCENT","liquidity_usd":0.38,"ratio_pct":1.56709819602254e-05,"source":"DEX Screener"},{"age_seconds":0,"kind":"VOLUME_ABOVE_MARKET_CAP","market_cap_usd":20653962.0,"source":"CoinGecko 24h volume and market cap","volume_24h_usd":90613452.0}],"status":"WATCH_ONLY"},"identity":{"cached_age_seconds":null,"contracts":[{"address":"0x370dd1181288392843bf52d998eb85c735d91688","chain":"robinhood","dex_chain":"robinhood","dex_status":"FRESH","dex_url":"https://dexscreener.com/robinhood/0x370dd1181288392843bf52d998eb85c735d91688","explorer_url":"https://robinhoodchain.blockscout.com/address/0x370dd1181288392843bf52d998eb85c735d91688"}],"source":"FRESH","status":"KNOWN","warning":null},"market":{"captured_at_utc":"2026-10-13T08:45:52.148071Z","change_24h_pct":0,"market_cap_usd":20653962.0,"price_usd":0.020653962237515592,"volume_24h_usd":90613452.0,"volume_market_cap_ratio":4.387218878392436},"mentions":{"google_news":{"coin_count_24h":0,"coin_count_7d":0,"error_class":null,"headlines":[],"listing_count_7d":0,"matched_item_count":0,"newest_age_seconds":null,"newest_published_at_utc":null,"query":"\"Wisp\" (crypto OR token OR coin OR \"WISP\") when:7d","query_at_utc":"2026-10-13T08:45:52.148071Z","related_count_24h":0,"related_count_7d":0,"related_headlines":[],"related_item_count":0,"status":"FRESH","undated_matched_item_count":0},"reddit":{"coin_count_24h":null,"coin_count_7d":null,"error_class":"HTTP_429","headlines":[],"listing_count_7d":null,"matched_item_count":0,"newest_age_seconds":null,"newest_published_at_utc":null,"query":"\"Wisp\" sitewide","query_at_utc":"2026-10-13T08:45:52.148071Z","rate_limit_headers":{"x-ratelimit-remaining":"0.0","x-ratelimit-reset":"52","x-ratelimit-used":"1"},"reason":"rate-limited by Reddit","related_count_24h":null,"related_count_7d":null,"related_headlines":[],"related_item_count":0,"status":"UNAVAILABLE"}},"momentum":{"comparison_at_utc":null,"mention_change_by_source":{"google_news":{"24h":null,"7d":null},"reddit":{"24h":null,"7d":null}},"rank_change":null,"state":"INSUFFICIENT_HISTORY","volume_change_pct":null},"name":"Wisp","observed_at_utc":"2026-10-13T08:45:52.148071Z","symbol":"WISP","trending":{"change":null,"previous_rank":null,"rank":1,"state":"INSUFFICIENT_HISTORY","window":"rolling 24h"}},{"coingecko_id":"identity-md-6900","dex_pairs":[{"age_seconds":75272,"buys_sells_by_period":{"h1":{"buys":1018,"sells":1230},"h24":{"buys":36620,"sells":34623},"h6":{"buys":10637,"sells":9941},"m5":{"buys":181,"sells":202}},"captured_at_utc":"2026-10-13T08:45:52.148071Z","chain":"robinhood","coingecko_platform":"robinhood","dex_id":"uniswap","fdv_usd":24090899,"is_primary":true,"liquidity_usd":495315.39,"market_cap_usd":24090899,"pair_address":"0x9B3554E6c26E06EBe55A7AeC4E86e486379C5f6B","pair_created_at_utc":"2026-10-12T11:51:20Z","pair_url":"https://dexscreener.com/robinhood/0x9b3554e6c26e06ebe55a7aec4e86e486379c5f6b","price_change_by_period":{"h1":3.2,"h24":947032,"h6":24.35,"m5":-1.9},"token_address":"0xe3e3df8bfb891d269a78ee33a456d36fb7344ec1","volume_by_period":{"h1":606142.22,"h24":23438932.25,"h6":5166809.08,"m5":88482.71}},{"age_seconds":53601,"buys_sells_by_period":{"h1":{"buys":0,"sells":0},"h24":{"buys":8,"sells":5},"h6":{"buys":0,"sells":0},"m5":{"buys":0,"sells":0}},"captured_at_utc":"2026-10-13T08:45:52.148071Z","chain":"robinhood","coingecko_platform":"robinhood","dex_id":"uniswap","fdv_usd":17229763,"is_primary":false,"liquidity_usd":21.11,"market_cap_usd":17229763,"pair_address":"0xc6b862e5c78e44ee7a333d09fe894f0775168d29325606b7baa3d194f5ede399","pair_created_at_utc":"2026-10-12T17:52:31Z","pair_url":"https://dexscreener.com/robinhood/0xc6b862e5c78e44ee7a333d09fe894f0775168d29325606b7baa3d194f5ede399","price_change_by_period":{"h24":0.14},"token_address":"0xe3e3df8bfb891d269a78ee33a456d36fb7344ec1","volume_by_period":{"h1":0,"h24":57.12,"h6":0,"m5":0}},